AP,HP,card_type_id,color_id,cost,effect,effect_en,id,image_url,image_url_en,name_en,name_ja,rarelity_id,tribe_id
2,4,1,1,3,前衛,Frontline,3140,https://d3n9a7g7xguuos.cloudfront.net/uploads/card/image/1808/3140.png,https://d3n9a7g7xguuos.cloudfront.net/uploads/card/english_image/1808/3140.png,Frozen Thunder Majin,雷凍の魔神,2,4
2,4,1,1,3,前衛,Frontline,3145,https://d3n9a7g7xguuos.cloudfront.net/uploads/card/image/1810/3145.png,https://d3n9a7g7xguuos.cloudfront.net/uploads/card/english_image/1810/3145.png,Frozen Thunder Majin,雷凍の魔神,3,4
0,1,1,5,7,攻撃不可 無敵 ターン開始時：第２形態に進化する,Cannot attack Invincible Turn start：Evolve to Second Form.,1180,https://d3n9a7g7xguuos.cloudfront.net/uploads/card/image/1812/1180.png,https://d3n9a7g7xguuos.cloudfront.net/uploads/card/english_image/1812/1180.png,Ancient Weapon Northern Cross,古代兵器 ノーザンクロス,3,8
4,6,1,2,5,召喚時：ソルジャーを除く全てのユニットに２ダメージ,Summon：Deal ２ damage to all minions except soldiers.,3005,https://d3n9a7g7xguuos.cloudfront.net/uploads/card/image/1817/3005.png,https://d3n9a7g7xguuos.cloudfront.net/uploads/card/english_image/1817/3005.png,Brass Magnana,真鍮のマニャーナ,3,5
1,1,1,4,2,飛行：召喚時：ハロウィン南瓜虫を２枚手札に加える,Summon：Add ２ Halloween Pumpkin Bugs to your hand.,3055,https://d3n9a7g7xguuos.cloudfront.net/uploads/card/image/1819/3055.png,https://d3n9a7g7xguuos.cloudfront.net/uploads/card/english_image/1819/3055.png,Halloween Bug,ハロウィンバグ,3,7
1,4,1,6,2,ターン終了時：他の味方魔法使いがいる時 カードを１枚引く,Turn end：When there is another friendly witch draw a card.,3080,https://d3n9a7g7xguuos.cloudfront.net/uploads/card/image/1821/3080.png,https://d3n9a7g7xguuos.cloudfront.net/uploads/card/english_image/1821/3080.png,Karma,カルマ,3,5
